{
  "$schema": "https://json-schema.org/draft/2020-12/schema",
  "title": "Content Published",
  "type": "object",
  "required": [
    "artifact_uri",
    "published_path"
  ],
  "properties": {
    "artifact_uri": {
      "type": "string",
      "pattern": "^s3://"
    },
    "published_path": {
      "type": "string"
    },
    "title": {
      "type": "string"
    },
    "description": {
      "type": "string"
    },
    "tags": {
      "type": "array",
      "items": {
        "type": "string"
      }
    },
    "public_url": {
      "type": "string"
    },
    "jellyfin_item_id": {
      "type": "string"
    },
    "jellyfin_public_url": {
      "type": "string"
    },
    "namespace": {
      "type": "string"
    },
    "thumbnail_url": {
      "type": "string"
    },
    "duration": {
      "type": "number",
      "minimum": 0
    },
    "meta": {
      "type": "object"
    },
    "studio_board_id": {
      "type": "integer",
      "minimum": 1
    },
    "publish_request_id": {
      "type": "string"
    }
  }
}
